{"attested_by_actor_id":"human:source-reviewer","does_not_establish":["Mathematical correctness, novelty, significance, scientific acceptance, or Standing."],"procedure":["Resolve every cited source to exact retained bytes and revision identity.","Compare the Claim text, conditions, and caveats with the source scope and terminology.","Report omissions, ambiguous equivalences, and material widening or narrowing."],"profile":"semantic-source-adequacy-v1","property":"semantic_source_adequacy","question":"Do the exact sources support the submitted statement at its declared scope?","required_output":["Exact source identities and inspected locations.","A statement-to-source comparison with every material mismatch.","Scope limitations and unresolved semantic equivalences."],"reviewer":{"display_name":"Example source reviewer","identifier":"replace-with-stable-reviewer-id","kind":"human","provider":null,"version":null},"schema":"vela.review-method.v1"}
