{"attested_by_actor_id":"org:review-coordinator","does_not_establish":["Scientific correctness, reviewer quality, policy authorization, scientific acceptance, or Standing."],"procedure":["Compare producer, verifier, performer, provider, host, source, method, and funding dependencies.","Classify claimed independence and list every shared dependency or unavailable fact.","Confirm that Verification is non-authoritative and that any Decision separately binds performer, authority principal, policy, signer, and current roots."],"profile":"meta-authority-independence-review-v1","property":"meta_authority_and_independence","question":"Are provenance, independence, shared dependencies, and the authority boundary stated exactly?","required_output":["An actor and dependency matrix with exact identifiers.","A scoped independence conclusion and shared-dependency disclosure.","Separate performer and Repository authority identities for any Decision."],"reviewer":{"display_name":"Example review organization","identifier":"replace-with-organization-id","kind":"organization","provider":null,"version":null},"schema":"vela.review-method.v1"}
